{
  "schema_version": "1.0.0",
  "logical_run_key": "run_01a2b3c4d5e6f789",
  "attempt_id": "att_01J6G7R8Q9ABCDEFGHJKMNPQ30",
  "experiment_id": "exp_01J6G7R8Q9ABCDEFGHJKMNPQ20",
  "correlation_id": "corr_01J6G7R8Q9ABCDEFGHJKMNPQ02",
  "configuration_id": "cfg_4f1b82d3e9a0c784",
  "task_id": "TASK-001",
  "repetition_index": 0,
  "run_state": "SUCCEEDED",
  "resolved": true,
  "failure_reason": "NONE",
  "failure_details": "None",
  "turns_executed": 3,
  "prompt_tokens": 1250,
  "completion_tokens": 420,
  "cached_tokens": 512,
  "total_tokens": 1670,
  "observed_cost_usd": "0.003662",
  "price_version": "2026-08-29",
  "latency_ms": 2450,
  "exit_code": 0,
  "assertions_passed": 3,
  "assertions_failed": 0,
  "eligible_for_aggregation": true,
  "ineligibility_reason": "None",
  "lease_owner": "worker_cr_instance_01",
  "started_at": "2026-08-29T10:00:26.000Z",
  "finished_at": "2026-08-29T10:00:29.000Z",
  "created_at": "2026-08-29T10:00:29.000Z"
}
